{
  "$name": "material3",
  "$version": "1.0.0",
  "color": {
    "primary": { "value": "#6750A4" },
    "surface": { "value": "#FEF7FF" },
    "onSurface": { "value": "#1D1B20" },
    "outline": { "value": "#79747E" }
  },
  "typography": {
    "fontFamily": { "value": "Roboto, sans-serif" },
    "display": { "fontSize": "57px", "fontWeight": "400" },
    "body": { "fontSize": "14px", "fontWeight": "400" }
  },
  "elevation": {
    "level1": "0px 1px 3px 1px rgba(0, 0, 0, 0.15)"
  },
  "radius": {
    "small": { "value": "8px" },
    "medium": { "value": "12px" },
    "large": { "value": "16px" }
  },
  "spacing": {
    "grid": "8px"
  }
}
